timestamp,id,name,observacion
2025-08-28T10:19:47,21,María Angélica Perdomo Estrada ,"La estudiante demuestra responsabilidad, seguridad y excelente desempeño en su práctica. En la sesión de hoy, mientras se trabajaba el fonema /f/, trajo un recurso distinto (títeres) al tipo de material que la maestra esperaba, pues usualmente se acostumbra trabajar con material para colorear y manipular. Aunque la expectativa no fue explicitada previamente, la estudiante resolvió la situación con prontitud diseñando el recurso en clase, lo que refleja iniciativa y capacidad de adaptación."
2025-08-28T11:06:38,23,Daniel Fernando Casas Avendaño ,"La maestra acompañante señala que al inicio la practicante mostró dificultades en el dominio del grupo, aunque mejoró tras aplicar orientaciones recibidas. En la clase de hoy evidenció avances: uso de recursos tecnológicos, material imprimible y actividades variadas. Se recomienda consignar el material en los cuadernos, revisar el trabajo por filas, ajustar la planeación con menos actividades, concretar mejor los cierres y reforzar la evaluación del aprendizaje. El balance es positivo."
2025-09-01T19:18:43,23,Daniel Fernando Casas Avendaño ,ssss
2025-09-02T06:41:05,6,Edna Valentina Rojas Ortega,La estudiante tiene un buen desempeño
2025-09-03T09:18:29,12,Nikol Dallana Rivera Guzmán,lvjonvnls
